{
  "$schema": "http://json-schema.org/draft-07/schema#",
  "$id": "https://github.com/StudentSuite/awesome-skills-plugins-for-students/data/schema/entry.schema.json",
  "title": "Skill or plugin entry",
  "description": "Shape of one entry in data/skills.json or data/plugins.json. Documented here for reference; scripts/validate-data.mjs enforces the same rules by hand rather than through a JSON Schema library, to keep this repo's zero-npm-dependency CI.",
  "type": "object",
  "required": ["name", "url", "description", "category", "marker", "supported_tools"],
  "additionalProperties": false,
  "properties": {
    "tag": {
      "type": "string",
      "enum": ["Study & Productivity", "Research", "Note-Taking", "Career", "General-Purpose"],
      "description": "Required on every entry in data/plugins.json (not used in data/skills.json, since skill categories already group those): a lightweight sub-area label shown after the description in README.md so the single flat Plugins list stays scannable as it grows (see #134). Not enforced by this JSON Schema file directly -- scripts/validate-data.mjs requires it for every Plugins entry and rejects it on any skills.json entry."
    },
    "name": {
      "type": "string",
      "minLength": 1,
      "description": "Display name, e.g. \"author/repo\" or \"author/repo - skill-name\" for a skill inside a monorepo."
    },
    "url": {
      "type": "string",
      "pattern": "^https://",
      "description": "Link target. Must appear exactly once across data/skills.json + data/plugins.json combined."
    },
    "description": {
      "type": "string",
      "minLength": 1,
      "pattern": "\\.$",
      "description": "One line, roughly 10 words or fewer, verb-first, ends with a period. Does not include the 🔑/🌐 marker -- that's the separate `marker` field."
    },
    "category": {
      "type": "string",
      "enum": [
        "IB & IGCSE Coursework",
        "Study & Productivity",
        "Coding & CS Education",
        "STEM Subjects",
        "Writing & Humanities",
        "Language Learning",
        "College Applications & Career",
        "Google Workspace for Students",
        "Plugins"
      ],
      "description": "Must match an existing README.md section heading exactly."
    },
    "marker": {
      "type": ["string", "null"],
      "enum": ["requires-key", "external-service", null],
      "description": "null for no marker. \"requires-key\" renders as the 🔑 prefix (needs a paid API key/account). \"external-service\" renders as the 🌐 prefix (always calls a live external service, no key needed)."
    },
    "supported_tools": {
      "type": "array",
      "minItems": 1,
      "items": {
        "type": "string",
        "enum": ["claude-code", "cursor", "copilot", "gemini-cli"]
      },
      "uniqueItems": true,
      "description": "Which of the four tools in the Compatibility Paths table this entry is built for. Defaults to [\"claude-code\", \"cursor\", \"copilot\"] for a plain SKILL.md-style entry; only entries with a specific, verified reason (like gemini-cli-extensions/datacommons shipping a gemini-extension.json instead of a SKILL.md) diverge from that default. This is a documented baseline, not a claim every entry has been individually spot-checked against every tool -- see issue #96."
    }
  }
}
